{
  "version": "plannerbundle.v1",
  "generatedAt": "2025-10-02T00:00:00Z",
  "source": {
    "aimVersion": "aimtable.v1",
    "aimRef": "examples/aimtable.v1.pass.json",
    "hierarchyVersion": "hierarchy.v1",
    "hierarchyRef": "examples/hierarchy.v1.pass.json"
  },
  "projects": [
    {
      "id": "proj-team-clarity",
      "title": "Operate as a calm, fast crew (TEAM)",
      "paths": [
        {
          "id": "path-a",
          "archetype": "A_SPEED",
          "slices": [
            {
              "id": "slice-clarity-owner-date",
              "title": "Owner + due date required",
              "status": "ready",
              "effortDays": 1,
              "aimNodeIds": ["team-role-clarity-cadence"],
              "beliefEffects": [
                { "aimId": "team-role-clarity-cadence", "weight": 0.6 }
              ],
              "dod": ["Schema requires owner and due date on create"],
              "evidenceMicroIds": ["team-role-clarity-cadence-1"],
              "callouts": {
                "negativeEffects": [
                  {
                    "aimId": "team-role-clarity-cadence",
                    "risk": "Ambiguous ownership causes thrash",
                    "severity": "high",
                    "cluster": "TEAM",
                    "weight": -0.6
                  }
                ]
              }
            }
          ]
        }
      ]
    },
    {
      "id": "proj-revenue-predictable",
      "title": "Predictable cash & compounding (REVENUE)",
      "paths": [
        {
          "id": "path-a",
          "archetype": "A_SPEED",
          "slices": [
            {
              "id": "slice-unit-econ-dashboard",
              "title": "Unit economics dashboard skeleton",
              "status": "ready",
              "effortDays": 2,
              "aimNodeIds": ["revenue-unit-economics-runway"],
              "beliefEffects": [
                { "aimId": "revenue-unit-economics-runway", "weight": 0.6 }
              ],
              "evidenceMicroIds": ["revenue-unit-economics-runway-1"],
              "callouts": {
                "negativeEffects": [
                  {
                    "aimId": "revenue-unit-economics-runway",
                    "risk": "Missing metrics hide burn breaches",
                    "severity": "medium",
                    "cluster": "REVENUE",
                    "weight": -0.8
                  }
                ]
              }
            }
          ]
        }
      ]
    },
    {
      "id": "proj-customer-trust",
      "title": "Learn fast & deliver felt outcomes (CUSTOMER)",
      "paths": [
        {
          "id": "path-a",
          "archetype": "B_UX",
          "slices": [
            {
              "id": "slice-demo-cadence",
              "title": "Set two-week demo cadence",
              "status": "ready",
              "effortDays": 1,
              "aimNodeIds": ["customer-outcome-proof"],
              "beliefEffects": [
                { "aimId": "customer-outcome-proof", "weight": 0.6 }
              ],
              "evidenceMicroIds": ["customer-outcome-proof-1"],
              "callouts": {
                "negativeEffects": [
                  {
                    "aimId": "customer-outcome-proof",
                    "risk": "Surprises appear late; trust evaporates",
                    "severity": "high",
                    "cluster": "CUSTOMER",
                    "weight": -0.8
                  }
                ]
              }
            }
          ]
        }
      ]
    }
  ]
}
